Timestamp,Response,Attend,View,Takeaway,Like,Change,Muni,School,Taxes,"How-address",Manual,Other
2019/04/04 10:50:00 PM AST,36,No,Yes,"That without changes to the in current use laws or significant increases in residential or commercial properties, then it will be very difficult to change the property taxes in the town of Lyme.",We like the rural character of the town and appreciate the fact that there are limited commercial properties.  The quality of the school was what made us consider Lyme in the first place and we were not disappointed in the education our children received.  We also came to Lyme knowing that it was a sending district and that our children would have the opportunity to go to Hanover high School.   We also like the many opportunities for recreation in the town of Lyme during the summer and winter.  ,"I believe that there are small opportunities for development that would improve the town of Lyme.  I do like the idea of senior housing in the town.  I would also like to see a coffee shop/sandwich shop/pizza takeout available at the town green. I could also see the town further developing it's trail systems for summer   and winter use and promoting the outdoor lifestyle that many people in the town appreciate.  Given the presence of the Green Woodlands and Dartmouth skiway and many recreation trails for skiing, snowmobiling, hiking and biking, including the AT, I don't see why the town couldn't also support a microbrewery or outdoor gear oriented business.  I also think that the town should continue to support the implementation of high speed internet in the town.  This will further enable commercial entities to consider the town for their business.  ",4,4,Too high,"I think the town should develop a plan that promotes some residential growth, fosters business activity in the town and takes advantage of our environment to bring in businesses that are consistent with the town and it's setting.  I also think the town should be more proactive in addressing changes to the in-current-use laws at the state level and/or changing state laws to allow more progressive ""use"" taxes to support town activities (e.g. Auto Registration, Costs per bag at the town dump, etc.).  I don't believe there is one answer here, but rather a lot of small changes will be required.",,I appreciate the fact that the town is actively engaged in understanding the tax revenue and expense challenges in the town.  I think that they should continue to search for creative ways to raise the tax base while learning about ways other similar communities are tackling these issues.  This will most likely require partnering with other communities to support legislative changes that will have a positive impact on rural communities like ours.
2019/04/05 2:35:32 PM AST,37,No,Yes,"Lyme has been growing successfully, minor tweaks in policy may be useful to address a few issues. Almost none of the suggested actions should significantly impact taxes - other consequences should be focused on.","Excellent mix of rural, spacious, small town features.  It's quiet and most people are agreeable, well mannered, constructive. It behaves like a community with strong involvement by the citizens.",Nothing,5,5,About right,,,"The drive toward expansion, increased housing, population.  I think the pressure to build will destroy this place.  (look anywhere else in the country ... people keep moving in to ""attractive"" environments and as a result they wreck the features that attracted them originally)"
2019/04/05 2:49:56 PM AST,38,No,Yes,There is no magic bullet.,"It is a diverse, comfortable, caring community.  People still help one another.  People look out for others who are in need.  There are lots of bright, interesting people who are willing to share their experiences.  The community has supported its schools, it students, and its administrators.",I have no strong feelings concerning change.  I am generally satisfied with the current status.,5,5,About right,"I, as many others, feel that taxes in the Town are high. However, if the time is taken to learn about the causes for the seemingly unreasonable tax rates, the rates will appear more reasonable.  Lack of State support for education as well as the onerous regulations concerning special ed are two examples of contributors to the level of taxes.  ",,Making sure that rash changes are not made which would permanently alter the character of the Town.
2019/04/07 12:09:18 PM AST,39,No,Yes,We have limited options to increase the tax base,The town is friendly. The school is excellent.,I'd love to see more workforce housing. We'd be better off with a mix of incomes among our resident.,5,5,Too high,"I really don't think we have many options, unless the state of NH adopts an income tax.",,"Thank your for working on the issue. I think a lot of people think there are simple solutions, but it's clear from the research and presentation that even if we _wanted_ large-scale commercial development, the infrastructure (sewer, water, internet) would not support it."
2019/04/08 10:10:36 AM AST,40,No,Yes,"Not surprisingly, there is no silver bullet. That there will be some gain from smart planned development but no miracle cure. That we have a lot more work to do to figure out how to make Lyme a viable place to live for people of all economic levels, particularly to make it a place where seniors on fixed incomes can continue to live. And where people who have blue-collar jobs or are teachers or  nurses can still afford to live.","Its beauty and recreational opportunities in all seasons (except mud season), the warmth of its citizens, the quality of its school, its proximity to Hanover and the Dartmouth campus, and the Lyme Country Store. ","I'd like to see us find a way to slowly grow Lyme in an effort to keep the tax rate as flat as possible. Further development along Route 10 seems smart and obvious. I was disappointed in the attitude of the leaders of the town that forced Mill Gardens out of town and into an attractive facility in Orford. I was disappointed in the attitude of some residents of Lyme who tried to block Bret Ryan's development along Route 10. We have an auto body shop at one end of town. So be it. We have an alternative heating company sprawled along Route 10 a bit south of that. So be it. We have an auto repair shop on Route 10 just north of the common. So be it. Compared to them, Bret Ryan's effort is an attractive masterpiece. Mill Gardens would have been just as attractive. We need to encourage more development like that along Route 10. A garden supply store in Lyme seems as obvious as a hardware store, some banks and a few restaurants. ",4,4,Too high,"See above. By encouraging attractive slow growth. The region needs housing. Affordable housing, for sure. But housing. Not unsightly garden apartment complexes or co-housing, but smallish, affordable single-family homes in developments not unlike, for example, what we have above Whipple Hill (scaled down). We should find ways to encourage small businesses to move to Lyme, as Northern Woodlands has done. New Hampshire Business Review had an interesting article recently -- https://www.nhbr.com/a-hub-for-tech-entrepreneurship/ -- that bragged about how popular the Upper Valley is for tech start-ups and medical device entrepreneurs, with most of them landing in and near Lebanon and finding it relatively easier to attract and retain qualified employees because of all the fringe benefits of moving to the Upper Valley. I think we can learn from that. For instance, think about the house for sale right now on the Common, between the library and the Consolidated Communications structure: wouldn't it make a perfect office space for a start-up or two, with all the advantages of small-town living, amazing recreational opportunities, a great elementary school and proximity to a major college with an engineering school and a first-rate medical center. Wow. We should encourage the right ""developer"" to buy that and convert it to office space, not unlike the building on the eastern end of the Common where Northern Woodlands has settled in. The Wagner building on Route 10 at the intersection of North Thetford Road is another great example of how a tax-paying business can easily fit into the corridor along Route 10, even among homes. Estes & Gallup is another great example. The Common and Route 10 should be our focus. The small house (Bill Gray) across from town hall has been for sale for a while. That, too, would be the perfect spot for the right kind of economic development -- office space for some start-ups, etc. It's quite close to Earl Strout's office park. Seems like a perfect fit. And no doubt you've already thought of all this!!",,"The town has to find ways to soften the ""control"" of the anti-development types who will simply just say no to any and all proposals. True, we have a lovely town and it's amazing to be able to take in all the beautiful farmland and forests and foothills. But that alone will not allow us to successfully attract and retain people of all economic levels. Right now the attitude seems to be to ""just say no."" And aside from the major battle that the anti-development crowd sometimes loses (Bret Ryan), that is not going to get us any form of progress. We need to encourage smart development. At this point, it seems as if that will be a very difficult objective to pull off. One last thought that was mentioned briefly in the public comment section of the presentation video: we should focus more time and effort at looking at what other towns have done to be successful in managing their growth, keeping their expenses in line and slowing the tax increases. Surely in the region, the state or in other rural areas in the Northeast, some towns have done this much better than others and we ought to be able to learn from their successes. That would definitely be worth an investment of time. But learning those answers without a change in attitude toward modest development won't get us anywhere. "
2019/04/08 10:15:44 AM AST,41,No,No,,"It still feels like a friendly, small town which is responsive to the evolving needs of its residents.",We must make it possible for middle and low income residents to live here.,4,5,Too high,Make it possible for modest income households and small businesses to exist. Cluster and senior housing must become available.,,Zoning is far too restrictive. Change is difficult due to downright bullying by a small number of very wealthy citizens.
2019/04/08 11:23:46 AM AST,42,Yes,Yes,lightweight ,"community, open space, village.",Adopt SB2 process to combine school and town warrant articles  with their final vote by official ballot. This would ensure a greater participation in the school budget and negate the use of vote by voice. The fact that 68% of Lyme's tax goes to the school system demands a change in the way budgets are agreed. ,3,2,Too high,"As above,  adopt SB2. ",,"The town should be actively engaged in developing town owned land as a recreation destination for the purpose of providing campsite facilities at charge. Preliminary investigations show that the town forest properly developed for camping could realize a minimum value of $250,000 per year.  This would also provide existing restaurants and related businesses to gain considerable income.  A big thank you to LCDC for the work it has done and hopefully will create a new and worthwhile path for the betterment of all Lyme citizens.
Duncan Mackintosh, 68 Breck Hill Road, Lyme. "
2019/04/08 12:46:03 PM AST,43,No,Yes,That there is little that the town will do to address the property tax burden that is forcing families out of town and is not sustainable. ,"Neighbors, friends, community support, community care. ",I would love it if the property taxes could be fair and sustainable so that families do not have to leave. ,2,2,Too high,"We should be addressing taxing some of the vast conservation lands, address land in use again, and allow more development. ",,"If the taxes continue to be this high and rise at this rate, families will continue to cycle in and then out of town and our community will continue to suffer. "
2019/04/08 2:29:33 PM AST,44,Yes,,Difficult to slower lower taxes ,A friendly and attractive community,Bewilling and  aggressive in finding solutions  to manage taxes,3,2,Too high,Add housing that is designed not to add school children and is tax positive,,be aware of the value of needs v wants
2019/04/09 9:36:35 AM AST,45,No,Yes,No surprises -- Residents pushing against Current Use which needs to be addressed at the State level.  Even if the Zoning Ordinance was eased we aren't going to be hit with big box stores and ribbon development that is referenced as a scare tactic by some residents. ,it's a very nice small town - I like living here,Free the Zoning Ordinance enough to permit better clustered development such as the proposed Pinnacle project.,5,5,Too high,The rate of increase is too high -- again this is an issue because State issues are being off-loaded to the towns.,,The major problem going forward is going to be road maintenance especially as we're likely to see more extreme weather events in the future.  We need to put together a more comprehensive plan of road maintenance together with a plan of future funding.  The present scatter-shot approach of various Warrant Articles at town meeting needs to be re-thought.
2019/04/09 11:57:08 AM AST,46,No,Yes,"We are not attractive to large retail outlets, but offer good opportunity to smaller businesses.  We could have a more balanced community if we developed some medium priced housing.  We are a perfect place for elderly housing.",Small friendly town.,Encourage new small business.  ,3,3,Too high,Closely examine our capital spending.  Perhaps outsource our town highway services.  The cost per pupil in our school is too high.,,"
Examine reasons for large percentage increases in both town and school budgets.  Send out a mailing explaining same to taxpayers/residents using only the facts.  Let us know how much of the  increases are due to inflation, increased services, or regulation.  Although I sound contradictory we should keep an open mind to new ideas/thoughts about programs and personnel because of our changing technological world.  

We need better internet services.

"
2019/04/09 2:13:21 PM AST,47,No,Yes,Large-scale commercial development isn't feasible but more residential is likely given need for more housing in Upper Valley.  Cost of new housing in terms of additional services vs. tax revenue is difficult to determine. Lyme is far above Grafton County average in the median home prices and property taxes. 67% of property taxes goes to education. ,"Pleasant, well-maintained community with mix of economic levels, friendly neighbors, and a strong sense of place.  ",More small-scale commercial development to broaden tax base.  Less land in convservation easement to bring more land open for residential and small-scale development.  We already have too much land in conservation.  ,3,2,Too high,"More small-scale commercial development and finding ways to cut school budget, larger class size, mixed grade classes in early years.  Also, it seems like there are a lot of town employees for a town of our size.  ",," The current tax burden is unsustainable, so I would urge the town to consider whatever it takes to level off the increases.  "
2019/04/09 2:46:59 PM AST,48,No,Yes,Growth isn't the answer,"Still a small town, great town events, people helping people, wonderful school, terrific recreation opportunities, super library","It would be great if taxes weren't so high, we need to advocate for more support from the state",5,5,Too high,Advocate for more help from the state line a state tax to underwrite education,,"Infrastructure- Deterioration of roads, bridges, culverts"
2019/04/09 9:55:43 PM AST,49,No,Yes,Lyme has an issue with its tax base,"Beautiful, small, close to nature","More, interesting commercial development",3,5,Too high,More commercial development ,,
2019/04/09 10:52:25 PM AST,50,No,No,,"It's rural nature with lots of scenic open land, and large-sized housing lots but with a close and caring community for support, and within 20 minutes of commercial resources  like shops, health care in Hanover, Lebanon, WRJ. I see Lyme basically as a small rural bedroom community for Lebanon, Hanover, WRJ businesses/companies. ","Maintain the infrastructure like schools, library, roads/bridges, police, and fire services. Need to plan ahead for expected issues like road maintenance, and capitol improvements like maintenance and updating of town equipment to prevent the need for emergency replacement if maintenance is deferred. I would not recommend bigger commercial/business development. I would  promote the development of dependable electricity and phone lines and cell phone access and high speed internet access everywhere in Lyme. I would support pursuing increasing some lower cost housing options without sacrificing the current joys of rural living that includes  large housing lots and lots of open land.  I do not support large scale increase in the town's population such as large scale dense housing developments with clusters of many houses on small sections of land. ",4,4,About right,,,
2019/04/10 4:43:46 AM AST,51,No,Yes,"I don't understand why we are pushing for further development. Having more mixed use and commercial properties would significantly alter Lyme and, in my opinion, not in a good way. I see that the town is trying to expand the tax base but I do not really agree that this is something that should be pushed.","I have lived in Lyme for 28 years. During that time the town has changed and it will certainly change in the future. But some things are the same: the rural character of the town, the natural areas interspersed between villages/neighborhoods, the long country roads, the outstanding recreation opportunities. Everyone is friendly in Lyme. We can walk around town, meet at the general store or the library, at the town beach or on a ski trail. We wave at each other when we run past an acquaintance's house. There is not a lot of traffic in Lyme - mostly on route 10, which is the only place that you really need to be careful if you are walking, running or biking, so kids can easily traipse around town to see their friends and explore this little world. There's no need for a stoplight. Life in Lyme is easy and there is a great sense of community.","Over my time living in town, the average residents have become wealthier and wealthier. I would like that the town's traditional residents are not squeezed out, and that there are more opportunities for actual real middle-class and working people to live there without needing to work at the hospital, college, or a tech company. Lyme used to be a farming community. Things change, but preserving or even re-creating more socioeconomic diversity would be great for the town in many ways.",5,5,About right,,,"I would be EXTREMELY hesitant to push further commercial development in town. There is not a need for every town to have a lot of commercial stores. At the moment, Lyme is primarily a place where people live, and where some operate their own small businesses. And that's really great!! The reality of living in Lyme would change a lot, and in my opinion for the worse, with more and bigger commercial venues. Being a primarily residential place is something that defines Lyme and makes us unique from some other towns to the south, and I think that is a benefit that draws people to live here. 

I also see that the town wants to expand their tax base, but to me any housing development that is pushed in the town should explicitly include units that make Lyme an accessible place to live for all people, not only for wealthy people who can pay a lot of taxes. Further gentrifying our town will probably only lead to more demands for more municipal services, and I see this as a runaway cycle that would lead to then another need to charge more taxes to provide these services. Thinking about the future of the town, let's think about the sense of community and how we can keep a vibrant, friendly, supportive, and resilient community, instead of just how we can make a community that pays more taxes. "
2019/04/10 8:27:55 AM AST,52,No,Yes,"The main message seemed to be that there's not much we can do, development-wise, to ease Lyme's tax burden.  That outcome, however, seems to be driven to some extent by the underlying modeling inputs, which assume a given impact (e.g., on number and ""type"" of kids, and hence school budgets, etc.) for each housing scenario.  Actual experience would suggest that real-world results can be much more volatile.  For example, just one new student who requires special services from the school (e.g., additional student aids, or even out-of-district placement) can blow up a budget and render the modeler's assumptions totally moot.  As such, ANY scenario that includes ANY sort of school-age kids is highly uncertain.  As Jeff Valence joked in the video, ""Do you feel lucky?""  In the end, I'm not sure that we can read too much into the modeling study -- except perhaps to assume that the potential downside (i.e., higher taxes from additional housing) is far greater than the potential upside.  In other words, additional development is unlikely to help taxes all that much (consistent with the modeler's results), but it could very well end up hurting taxes much more than shown in the modeling results.

Two other, more-general critiques of the modeling study:  (1) the focus on comparing Lyme to the rest of Grafton County rather than to other Upper Valley communities seemed short-sighted (I agree with Karl Furstemberg's comment to this effect); and (2) the scope of the modeling scenarios all seemed to involve either housing or retail development, and ignored other forms of potential development that could generate revenue for the town (e.g., a solar farm or something like that -- something that can generate revenue but require little or no town services).  It would have been nice to see a little more ""out of the box"" thinking along these lines, rather than focusing on only new housing or a WalMart (or a Market Basket).

At the end of the day, given that we're stuck relying on property taxes to raise revenue, and given the high percentage of property in town that is either not taxed or taxed at a very low rate, we may need to look outside of Lyme -- e.g., to Concord -- for solutions.  I agree with Jennifer Boylston's comments that we should lobby for consideration of more-equitable statewide distribution of the ""current use"" burden, or even a statewide income tax.

One other half-baked idea:  Can we convert some town roads to toll roads, at least for out-of-town users?  For example, the dirt section of Dorchester Road gets a lot of out-of-town users (e.g., traveling to Smarts Mountain or Green Woodlands) who presumably inflict quite a bit of damage to the road surface when it's soft (like in mud season).  Same with River Road, which is used by commuters to Hanover.  Lyme ends up footing the bill to keep these roads in decent shape, even though Lyme residents are probably responsible for only a fraction of the damage.  Given today's technology (e.g., EZPass, cameras, etc.), it seems like there should be a way to easily and cost-effectively collect tolls -- but is it legal?  More broadly, what about paving some of these dirt roads?
",I like Lyme's rural character and natural beauty (but would be happy to lose some of the dirt roads).  The K-8 school also fosters a nice environment for Lyme kids.,"It would obviously be nice to reduce the cost of living here!  Seeing a little more vibrancy and variety in the commercial districts (e.g., downtown, at the old Getty station, at Lyme Business Park just north of town) would make it a nicer place to live (as having to drive north or south for some basic services gets a little old).",3,4,Too high,"The increases seem too high when compared to the general rate of inflation (negligible) over this same period.  I do understand, however, that there have been some larger-than-normal road problems that have contributed to costs.  More-proactive road maintenance (e.g., I can't remember the last time our dirt road was ditched -- making it more-susceptible to washouts), or even paving some roads that are now dirt, could potentially avert some costly fixes down the road.  

If development (or at least housing/retail development, as studied) is unlikely to raise much tax revenue, then we need to sharpen our focus on costs, and cut where we can.

Finally, Lyme is also one of the wealthiest towns in the state -- how about lobbying for an income tax, which would equalize the tax burden a bit more?  Those who are wealthy will hardly notice; those who are struggling with the property tax burden because they don't have much income will presumably feel some relief.",,"Has the school board ever tried to negotiate high-school tuitions, or are we purely price-takers?  Seems like high school tuition is a large part of the school budget (though may ultimately be cheaper than having our own high school), and if these area high schools love Lyme's tuition so much, perhaps we have a little bargaining leverage we could exert?"
