Timestamp,Response,Attend,View,Takeaway,Like,Change,Muni,School,Taxes,"How-address",Manual,Other
2019/03/30 12:10:12 PM AST,1,No,Yes,"we have a great school! we are not imagining that our taxes are high. Also, that they feel further residential development would not raise our taxes, which contradicts most studies that show that residential development costs more in town services than it brings in in taxes. ","Rural feel, historic character, village historic districts, accessibility of outdoors, dark sky and lack of street lights most places, gravel roads, COMMUNITY SPIRIT, terrific school, and the authenticity of having residents born and raised in Lyme - we're not just a fancy bedroom community. ",Better internet service; bury ugly power lines in Lyme Village; remove garish and oversized new highway signage from Lyme Village; more opportunity for seniors to age in place (or in smaller Lyme homes) affordably; public transportation to Hanover,5,5,Too high,"if it is indeed true that residential development will not increase our taxes, concentrate this development around areas already thickly settled. Permit limited multi-family homes in scale with surrounding area. ",,
2019/03/31 12:46:38 PM AST,2,Yes,Yes,"Lyme is doing well. Good Schools, good community. It's expensive to live here. You get what you pay for.",Good schools. Friendly community. Beautiful surroundings. Commercial district that's small but sufficient. Easy commute to work centers.,More housing available to low and middle income families. Diversity of economy is a good thing. Rich ghettos are culturally stale.,4,5,About right,The fact that the tax rate has increased 37% is not unique to Lyme. A 2% premium to live in this town as opposed to the surrounding towns is not excessive.,,I think the town should plea to the State that the Current Use law is unfair to Towns like Lyme where most of the property is under tax easement. 
2019/03/31 6:40:17 PM AST,3,No,No,,"In general, I like the rural character of the town and its conservation ethic.","I wish Lyme could retain its rural character, while encouraging modern communication technologies such as high speed internet and improved cellular service.",3,3,About right,"I think the Town's zoning regulations need to be loosened somewhat, to allow for greater commercial development in certain parts of Town, which will ultimately improve the tax burden on residential homeowners.",,"I see no reason why the Town can't allow for modern communication services like high speed internet and cellular service, while still maintaining its rural character. Zoning regulations should not prohibit or severely restrict the creation of things like cell towers, if the addition of one or a few towers somewhere in Town results in coverage comparable to towns like Hanover and Lebanon."
2019/04/01 8:59:31 AM AST,4,No,Yes,Good analysis. No biases. Confirms what we mostly know already.,"Sense of community, rural environment.","Better Internet - Go, LymeFiber!",5,5,Too high,"Lobby Concord to stop downshifting funding, even if it means having an income tax.",,See if there's sufficient demand for public transportation to encourage Advance Transit to serve Lyme.
2019/04/01 10:02:41 AM AST,5,No,Yes,I was able to access it but unable to watch the full video due to time/internet connectivity.,"Friendliness, sense that people are willing to work together and dig in themselves to make things happen vs. sitting back and waiting for it to get done.",For people to continue to feel engaged in the process and that spirit of being willing to help to be propagated. ,5,5,About right,"Given the way in which our State designates that funds must be raised and the continued downshifts of expenses to the local level, I think the only way to address would be lobby at the State level to free the town to look at other mechanisms other than property tax to support local expenditures.",,
2019/04/01 10:05:41 AM AST,6,Yes,Yes,That the consultant really likes Lyme,Great school system. Lively Common area.,"Zoning needs to be changed to allow higher density living outside the common area. Need new members of the planning board to bring new ideas. Need a cell tower of some type to address bad cell coverage.  Hoping Fiber will be here by next year. Need to address current use issues in town with the state. Increase commercial district to include the entire Rt 10 corridor (Bring this to the town via a warrant article). Overall, give voice to the newer residents who tend to be younger and unable to volunteer due to family and work responsibilities.",3,5,Too high,Change zoning laws to allow higher density building outside of the common area. Rt 10 should be a commercial zoning area both sides of the common. Town should try to attract developers to build small scale developments (condo's and apartments) to meet Upper Valley needs. Reverse the no development ethos that Lyme is know for.,,Cell service.  
2019/04/01 10:18:50 AM AST,7,Yes,Yes,"I appreciate all the time and effort the LCDC has put into this concern, working with the planning board and the budget committee. Many people in the town are concerned about rising taxes, and how the budget might be addressed. Reactions at the Forum seemed to be mixed on whether business growth and more development is the answer. ","Positive elements of living in Lyme include beautiful open spaces and a focus on conservation, a few thriving businesses, a good elementary school and a population of dedicated and compassionate townspeople. ",I'd like to see a few more healthy businesses in the center of Lyme. This would make living in the town more attractive and keep our dollars from being spent elsewhere. I'd like to see more cell phone and high speed internet access. We also need more mixed affordable/safe housing for older residents/young people.,4,4,Too high,I think the business base should increase so as to relieve some of the tax burden. There could also be a discussion regarding how much of the land is in conservation easement.,,"We are fortunate to have a good school system. However, the budget for this continues to rise substantially. How can we address this without compromising the quality of education? Another issue is transportation. Perhaps the town could try sponsoring one bus in and out of Hanover in the morning/evening for commuters and students."
2019/04/01 10:34:44 AM AST,8,Yes,Yes,"Not much honestly, kind of just rehashed what we know. ","The community spirit, the access to the outdoors, the great schools","More diversity and inclusion of different income levels, also access to smaller footprint development",5,5,Too high,"Ease restrictions on zoning, I don't think commercial is the answer but we need to allow more access to families and younger generation of people. The avg. new home built or for sale in town seems to be around $400K, it's pretty obvious this is a non-starter for most people. ",,"Town Govt is hard to participate in if you are a younger couple with children. I feel our boards are represented by a small specific population in the town. Many voices are not well represented, we need to find a way to engage more people in town policies, events etc. "
2019/04/01 10:45:15 AM AST,9,No,Yes,"Lot of detailed information, some new and some I anticipated. We do need to tighten up financially and with what we want our town to look like down the road.",We have the best school around.,"We have one town office employee who should consider a career elsewhere. In thinking about everything, I would like Lyme to retain it's current qualities. I know that is selfish, but since I moved here 32 years ago, enough has evolved such that I don't want any more growth, no higher taxes, etc. Where we are is perfection in all areas.",4,5,About right,"I can handle living here now, but if taxes increase high, I will move.",,
2019/04/01 11:20:22 AM AST,10,Yes,Yes,"Lyme can't ""build"" it's way out of the tax rate issue, but slow organic growth appears to be best as in the past.","Rural character, not developed like Hanover or Lebanon. Safe and friendly, outstanding volunteerism.","Nothing, although the school needs to get a grip on costs.",4,3,About right,"As mentioned above, school board needs to control educational costs better.",,
2019/04/01 11:31:44 AM AST,11,No,No,,"For the most part, a generous, convivial town.",,3,4,About right,,,"End the capricious -- or biased -- closing of Dorchester Road to traffic in spring. It is a public road. We shouldn't be denying the public access to it by declaring it's meant only for ""local traffic."" That's denying equal rights to all. If it's not an emergency or there isn't an ACTIVE work crew repairing the road, it should be open and free to traffic."
2019/04/01 11:56:16 AM AST,12,No,Yes,I couldn't watch it all - much of it does not lend itself well to video format. I would suggest a transcript of the more salient points is more helpful. ,I like that it is mostly open space and forest and that the zoning ordinance recognizes natural restrictions on construction/development. ,I hope the town will embrace an in-fill ethic such that existing structures and already-converted land can provide their highest value at a given time. ,4,,About right,"Perhaps town leadership and citizenry could advocate for sensible broad-based taxation such as an additional 1% on the meals and rooms tax dedicated for in-town use. Of course, then we'd all have to help publicize those businesses that collect that tax. ",,I hope we can disabuse ourselves of the notion that building more residences as a means of increasing tax revenue is anything but folly.
2019/04/01 12:12:58 PM AST,13,No,Yes,,like it just fine as is,make sure no cluster housing come in to spoil our town,2,1,Too high,"cut the waste at the school, have you ever  seen the waste there, have you really looked?",,"have one amount of money  for all high school students, make Thetford our HS; parents should kick in any amount that is over  what our HS gets








hS"
2019/04/01 1:03:15 PM AST,14,No,No,I will take a look at it...,"Sense of community,  preserved spaces, school has excellent reputation which supports property values.","Support for planned unit developments which would enable denser population building projects without equivalent expansion of land use.  There is a market for affordable condo-style housing that would increase the tax base and be attractive to potential home buyers in the Hanover area.  Lyme has the reputation of being hostile to any new development, both  commercial and residential.  The zoning board is viewed as seeking means to thwart development rather than encourage it. Whether or not that is true, I don't know -- but that is the reputation. 

Better road maintenance.",3,4,Too high,"See answer above.  The only way to get taxes down and preserve services is to increase the tax base.  Yes, this puts more pressure on the services (such as the school) but, overall, it is a benefit to the town to increase appropriate commercial and residential development, and to shed the town's closed-door reputation. As White River Junction has done, Lyme could make itself more of a destination town for crafts stores, clothing, restaurants, recreation (e.g., yoga, athletic gym space), festivals, even office space and professional services.  Lyme seems to cherish its insularity, to the detriment of its tax base.",,"The roads!  
In a perfect world, an expanded library and access to the arts."
2019/04/01 1:08:30 PM AST,15,No,No,Didn't attend/view,It's size,more affordable housing,4,4,Too high,"In the last few years the Town has spent a great deal of money, for example. upgrading our secondary roads -- where once it was acceptable to have to walk in to your house for a couple of ""mud season"" weeks, now every last rut and mud hole must be fixed in a day so a sports car can get home.",,"As long as commercial development is severely restricted, the taxes will be high as there won't be development (without school kids) to help keep the tax rate down.  There are sections of the RT10 corridor that could see commercial development without adverse impact on the rest of the Town -- just get over the NIBY for the good of the whole Town."
2019/04/01 1:40:01 PM AST,16,No,No,,"Rural character, some amenities(restaurants,store,inns), outdoor activities/resources(trails, pond, river,etc)",Need a small commercial zone expansion south of town to reduce tax burden.,3,2,Too high,"Create/expand a small  commerical zone on the south side of town on Rt. 10. Create a maximum current use benefit.(re 10 acres, unless active agriculture can be proved for 2/3 of the land in current use.)",,"Commit 100% of the high school student population to (1) high with a long term agreement negotiated for that cost, eliminate ""tuitioning choice""."
2019/04/01 1:42:16 PM AST,17,No,Yes,That Expanding the tax base will likely require planning and zoning changes.,Our culture.,Building opportunities for businesses to locate here,4,5,About right,,,
2019/04/01 2:31:59 PM AST,18,No,Yes,There is no magic bullet,"Beutiful landscape, preserved land, small town feel",More control on town and school expenses,3,3,Too high,More control of Town and School costs,,
2019/04/01 3:47:22 PM AST,19,No,Yes,That the community fears of increasing school enrollment were not realistic and that there were no magic bullets for increasing revenue ,Many people pride themselves on community involvement,More diversity and some basic service functions,3,3,Too high,The continuation of paying for ever increasing costs of town govt through local taxes is not viable and it is absurd that NH will not bite the bullet and have a state tax. Since that probably won't happen in the near future we have little option but to entice some business to Lyme- not non-profits and to allow affordable housing that is more cost efficient. I appreciate the report did not show a big increase in taxes or students with these options but it could be helpful none the less to keep the new property sales from sky rocketing because of their rarity.,,"What type of business might Lyme residents prefer and what would draw others to shop here? Is connecting with a bus or local transportation service a viable option to decrease auto dependency and its resultant expense, pollution and waste?"
2019/04/01 3:53:36 PM AST,20,No,Yes,"People seemed to be working thoughtfully to find a solution. I hope there will be another opportunity for a live forum. So far there is no silver bullet solution.
 I think progress is made as people hear each other's remarks and can build on those.",Lyme is still fairly a heterogeneous town with a good mix of building and open space.,I would like there to be more opportunity for  people of different incomes to live in town--affordable housing. better internet.,5,4,Too high,perhaps zone more areas commercial and improve the internet,,senior housing
2019/04/01 5:14:54 PM AST,21,No,Yes,That expansion of the tax base without increasing school size (commercial or senior housing) is the most practical way to lower taxes without giving up services.  ,Most everything,Lowering the tax rate is a good goal. ,4,5,Too high,"Have a very open and honest (but difficult) conversation about education spending.  What are the cost differences between the high school options available? Should parents pay the difference between the lowest cost option and their choice?  Can high school costs per student be renegotiated? How much does the town spend on special education per student and is that cost practical? Does the town pay for students younger than high school age to attend other schools if they choose? If so, how much and why?  The difficult reality is that if education quality remains high then more parents of young children will move to Lyme. ",,"The slide deck shown by the consultants was useful to understand the relative benefit of various development options, but the debate that I hear around town has not advanced to that stage yet, it is still change vs no-change. Once people accept that change needs to happen, then the town can debate the best form of change.  What I thought was missing from the consultants report was a slide projecting what the demographics of the town look like if current trends hold.  If high education spending is driving out older residents and high education quality is attracting younger residents with school age children then what does the town look like in 10 years if nothing is done to change current trends?  What would the tax rate have to be to maintain school spending with 20% more kids?  Will the faction that wants no change like what they see in 10 years if we do nothing now?  It is easy for people to say that they like things the way they are now, but the reality is that the town is always evolving. LCDC should help people understand what the future looks like if we do nothing.  Status quo isn't an option. "
2019/04/01 6:29:55 PM AST,22,No,No,,,,2,2,Too high,"The town needs to tighten it's belt rather than giving in to every request, we're going to ruin our real estate values because we want utopia",,
2019/04/01 6:40:41 PM AST,23,No,Yes,Additional development has negligible impact on town income.  It is not a viable solution for Lyme's high tax rates.,It is a small rural community.,-,4,3,Too high,"Consider a school surcharge tax, based on the number of household members using the school system.  This encourages younger (pre-kids) families to move to Lyme, as well as encouraging older families to remain in Lyme after children graduate from the school district.  Introduce this as a small additional tax and grow it over the years, and keep it at reasonable levels.",,-
2019/04/01 7:14:38 PM AST,24,No,No,,,,4,4,About right,,,
2019/04/01 8:15:20 PM AST,25,No,No,,"Participation - people seem actively involved and care about each other.  In spite of any criticisms or ideas listed below, I believe the town works hard to be good to its citizens.","Change town meeting to evenings.  More communication from school to town, especially those without students, such as posting links to school newsletters/activities on the listserv.  Those of us without kids would be more supportive if we knew more about the interesting things going on there.",3,3,Too high,"Pay off debt before taking more on.  More careful purchasing, such as sometimes purchasing used equipment instead of new, or simply making do with things for longer.  Outsource more administrative tasks or possibly reduce hours even more depending on volume (always deserted when I show up).  Only 1 policeman.  I don't interact much with the school, but I'm guessing the same points would hold true there.",,
2019/04/01 9:08:17 PM AST,26,Yes,,"There are no apparent answers to greatly increase the tax base. We should look to model after successful, comparable towns around the country.","Small town charm. Educated residents with interest in nature, charity and student education.",Lyme needs a manager...someone working with everyone's best current and future interests in mind. Better businesses.,2,3,Too high,Support a NH income tax and rally behind state support of education.,,
2019/04/01 9:09:46 PM AST,27,No,Yes,Lowering taxes or maintaining the tax rate in Lyme is impossible,"Great family town, not for someone on a fixed income",We need to challenge the state of NH to change land use. It is killing the middle income taxpayer of Lyme.,2,3,Too high,Define and pursue the needs necessary to attract  small businesses,,Zoning to encourage small home building
2019/04/01 9:37:45 PM AST,28,No,Yes,There is a demand for developing Lyme to help reduce taxes,It is not crowded.,Not much,5,5,Too high,Reduce expenditures.,,"We live here because it is not West Lebanon, Manchester, or Metro Boston. Stop the developers, now."
2019/04/01 9:39:20 PM AST,29,No,Yes,There is a demand for developing Lyme to help reduce taxes,It is not crowded.,Not much,3,3,Too high,Reduce expenditures.,,"We live here because it is not West Lebanon, Manchester, or Metro Boston. Stop the developers, now."
2019/04/02 1:40:16 PM AST,30,No,Yes,,"I like Lyme very much.  Like its sense of community and school.  I like town officials i.e. clerk's office, dump personnel, ",,4,5,Too high,,,Consider everything and anything.  Is everyone paying their fair share.
2019/04/02 11:41:43 PM AST,31,No,Yes,it would be difficult to lower the tax rate,"pride in the community, caring of neighbors",lower taxes so long time residents don't have to move out of their homes ,4,3,Too high,not sure,,keeping taxes stable for elderly home owners
2019/04/03 9:47:33 AM AST,32,Yes,,Modest development could help to mitigate tax increases.,small friendly community,More small commercial enterprises and services.,3,2,Too high,Control school costs,,I would like to see more planning for the future.  Being more proactive will help mitigate future tax increases and help us prepare for large future expenditures.
2019/04/03 2:32:59 PM AST,33,No,Yes,First class services that we demand cost a lot,Size,Not sure,3,2,Too high,Yes,,
2019/04/04 7:02:00 AM AST,34,No,Yes,"Housing needs -- senior, affordable",Most things,Current Use tax burden shifting,5,5,About right,"I think Lyme's tax rates are OK, considering the benefits of living in Lyme. I question the anecdotal claims that people move out primarily because of taxes. ALL costs of living are increasing, and someone won't escape taxes by moving. The shifted costs of Current Use are the largest portion of our tax bill, after municipal and school.",,
2019/04/04 12:36:38 PM AST,35,No,Yes,"It was an excellent synopsis of the pressures the town faces.  It is clear there is no one solution to our tax burden issue.  That, however, does not imply there is no solution, and instead indicates that it is multi-factorial.  ","The school, quality of life, ability to offload roadkill on the listserv in 5 minutes.  ","Cell reception, reducing land tax easements, adding commercially zoned locations at more locations, such as the west and north of town.",5,3,Too high,"
Again, there is no single magic bullet, but we can attack this problem on multiple fronts.

1) Increase revenue by revisiting taxing of land in current use and conservation easement. 
I understand that is a Statewide issue, but it has an extremely large impact on our town. I agree with Rusty regarding the significant gaming of the tax system by some landowners in Lyme to offset their land taxes at the expense of the rest of us without large tracts of land.  The forestry argument is sock-puppetry to divert from addressing this underlying problem.  

1a) Having essentially all undeveloped land in current use/conservation easement means there will never be land available to put a cell tower in town.  Bravo, Lyme, on the self-inflicted wound keeping us stuck in the 1990s telecommunications-wise.

2) Renegotiate Hanover HS tuition.
A few years ago, Jeff Valence said there would be negotiations with the Dresden School district to address the very high tuition payments the town makes to send kids to HHS.  70% of Lyme HS kids now go to HHS, and that school has the HIGHEST public tuition in the state.  In addition, financial incentives need to be implemented to compel parents to send their kids to other schools.

3) Increase *realistic* commercial development. 
Consider making a list of what types of companies would be fine with no sewer or town water.  What companies would be fine with 3000 cars per day?  Look at nearby towns to the N/W/E of us that have similar limitations.  Gyms, nurseries (*cough* Menges' NIMBY *cough*), pop-up coffee shops, offices, used book stores.  I think the bar has been set too high in that people expect only top-tier, high quality commercial enterprises to come in, but it has to start organically, which will mean a little lower quality at first.  Let's not be too precious about ourselves here.

4) Increase revenue by adding aging-in-place communities. 
Continually changing the goalposts for getting the Pinnacle Project certified is absurd and shameful.  The pearl-clutching whaddaboutism and scaremongering of the Planning Board is farcical and embarrassing.  Seriously, I'd be fine if the Bailey's *voluntarily* cashed out their farm and we got more houses and businesses there.  Good for them.  That's the market at work.  Let's not hamstring our town because we want to see cute goats and turkeys on our commute home in the evening.

5) Increased commercially zoned locations in town.
West Thetford Road, Rte 10 North near Mill Gardens, near skiway, Rte 10 South of town.",,"Lyme is incredibly lucky a) to have very wealthy people living here and b) be located next to a major university and hospital.  Similar reasons are why Ithaca NY prospers in the middle of upstate New York (i.e. Cornell), while other towns on the Finger Lakes are dying.  So while we all say it's our town's esprit de corps that sets us apart, people think the same no matter where there are.  **Honestly** it's location and money.  And the money is here because of location.   Consider how town projects, big and small, are funded by the local super-wealthy (Lyme Fiber, new sheet for town ice rink, Lyme Foundation grants, etc.)  Lyme residents do a very good job on making this happen, and it needs to continue, and even be enhanced, as the town moves forward.   That doesn't address any of the tax issues I mention above, but I just want to highlight that it's a funding source that needs to be persistently utilized."
